{"canonical_ciphertext_sha256":"e21f5924b6eba5a6d942348ac4473493deaecd45ebaeab3b82563bc835258bb6","canonical_key_id_sha256":"7f775ffd87cc37c40696bbf61b10309fd91564829a5e10033a0208ae7a8d88f9","completed_at":"2026-09-03T03:49:35Z","create_key_receipt_sha256":"c7021d459f95bd4cee40162a9b08fa6a6d6e50e98cc46bb8b9c86c28e3dbf717","create_plan_sha256":"2eab6298fb06798218381543c8f3c1dcba962adf3fc0bc1fb69a2e81e19a39b5","deactivate_key_receipt_sha256":"26f5e83e3d6cff27f2172ba307a52d33fa9f0f7690357e9e22ea0de25f242411","deactivate_plan_sha256":"61ae5390e74e46240da2c3d56bfe79924a158fa04bbc4701e0dd34a15eb910d2","delete_key_receipt_sha256":"1e82b87ab40e15c5a818543deb11f4f4a58fa67e5b60fbe871264ad45afd00cb","delete_plan_sha256":"b98a6d8fd24090c695b265b3c663d5211dcb593b96006663977ed027bd8055b4","failed_attempts":[{"effect":"new-key-created-then-deleted","plan_sha256":"46316fcb01956ff4bcbb4f49656ef057cdb2acb30e46982c85be371b0e99a7ce","postcondition":"one-original-active-key"},{"effect":"old-key-deactivated-then-reactivated","plan_sha256":"352832f83abe04081347a5273cf96c0dd125fa4a1b7f4315ebc75450f6ea27c7","postcondition":"two-active-keys"}],"independent_recovery_decryption":"passed","key_count":1,"key_status":"Active","object_bytes":114746920,"object_ciphertext_sha256":"4b62aaa4857ec68822392752d3cce758af981e106b79d8cb969cd6538bb14164","object_key_sha256":"597d15ebe79ac54dbdd3a787867bf44c38379901e3dbd33a6e16d36898307324","old_key_id_sha256":"ec2e5aa8754f9f1eb8fa81036588502b496e274b9aa144a682fea8be2132f382","old_key_state":"Deleted","policy_document_sha256":"bfaef172af786b2c3bd9387c70e3f808022630908d2a67048cca41cb0bea5ee5","principal_arn_sha256":"cbfd4986207c28758c6d4561f6636cbaf31bbeca8972891d347ed25180be2ac7","rotation_capability_enable_plan_sha256":"3ca6f8f804e1bbfac3edaa9350d7aedb1f5c8e535893b80b760ee2fd38f8f970","rotation_capability_removal_plan_sha256":"f452234408a6553fc611abd9a2fc55c4afc05c46ea4b421fbfa4294f2e515a9c","rotation_capability_state":"absent","s3_qualification":"kms-checksum-head-passed","sts_qualification":"passed","version":1}
